{
  "schemaVersion": "1.0.0",
  "ruleSetId": "griffierecht-civiel-dagvaarding",
  "version": "2026.1",
  "validFrom": "2026-01-01",
  "validUntil": "2026-12-31",
  "jurisdiction": "NL",
  "domain": "civiel-rechtbank",
  "procedureType": "dagvaarding",
  "conflictResolution": "first-match",
  "rules": [
    {
      "ruleId": "GR-KAN-2026-001",
      "name": "Kantonzaken — eiser natuurlijk persoon of onvermogend",
      "priority": 200,
      "legalStatus": "wettelijk",
      "sourceRefs": [
        {
          "type": "wetsartikel",
          "title": "Wet griffierechten burgerlijke zaken (Wgbz)",
          "section": "Artikel 2, eerste lid, onder a — griffierecht kantonzaken",
          "url": "https://wetten.overheid.nl/BWBR0035817/"
        },
        {
          "type": "rechtspraak-tarieftabel",
          "title": "Griffierecht civiele rechter 2026",
          "section": "Kantonzaken — eiser/verzoeker natuurlijk persoon",
          "url": "https://www.rechtspraak.nl/SiteCollectionDocuments/griffierecht-civiele-rechter-2026.pdf"
        }
      ],
      "conditions": {
        "zaakstroom": [
          "kanton"
        ],
        "rol": [
          "eiser",
          "verzoeker"
        ],
        "partijType": [
          "natuurlijk_persoon",
          "onvermogend"
        ]
      },
      "outcome": {
        "griffierecht": {
          "amount": 91,
          "currency": "EUR"
        },
        "category": "kanton_vast_tarief",
        "confidence": "deterministic",
        "manualReviewRequired": false
      },
      "examples": [
        {
          "input": {
            "vorderingWaarde": 5000
          },
          "expectedAmount": 91
        },
        {
          "input": {
            "vorderingWaarde": 25000
          },
          "expectedAmount": 91
        }
      ]
    },
    {
      "ruleId": "GR-KAN-2026-002",
      "name": "Kantonzaken — eiser niet-natuurlijk persoon, vordering ≤ €25.000",
      "priority": 200,
      "legalStatus": "wettelijk",
      "sourceRefs": [
        {
          "type": "wetsartikel",
          "title": "Wet griffierechten burgerlijke zaken (Wgbz)",
          "section": "Artikel 2, eerste lid, onder a — griffierecht kantonzaken",
          "url": "https://wetten.overheid.nl/BWBR0035817/"
        },
        {
          "type": "rechtspraak-tarieftabel",
          "title": "Griffierecht civiele rechter 2026",
          "section": "Kantonzaken — eiser/verzoeker niet-natuurlijk persoon, vordering ≤ €25.000",
          "url": "https://www.rechtspraak.nl/SiteCollectionDocuments/griffierecht-civiele-rechter-2026.pdf"
        }
      ],
      "conditions": {
        "zaakstroom": [
          "kanton"
        ],
        "rol": [
          "eiser",
          "verzoeker"
        ],
        "partijType": [
          "niet_natuurlijk_persoon"
        ],
        "vorderingWaarde": {
          "lte": 25000
        }
      },
      "outcome": {
        "griffierecht": {
          "amount": 91,
          "currency": "EUR"
        },
        "category": "kanton_vast_tarief",
        "confidence": "deterministic",
        "manualReviewRequired": false
      },
      "examples": [
        {
          "input": {
            "vorderingWaarde": 10000
          },
          "expectedAmount": 91
        }
      ]
    },
    {
      "ruleId": "GR-KAN-2026-003",
      "name": "Kantonzaken — eiser niet-natuurlijk persoon, vordering > €25.000",
      "priority": 200,
      "legalStatus": "wettelijk",
      "sourceRefs": [
        {
          "type": "wetsartikel",
          "title": "Wet griffierechten burgerlijke zaken (Wgbz)",
          "section": "Artikel 2, eerste lid, onder a — griffierecht kantonzaken, niet-natuurlijk persoon boven €25.000",
          "url": "https://wetten.overheid.nl/BWBR0035817/"
        },
        {
          "type": "rechtspraak-tarieftabel",
          "title": "Griffierecht civiele rechter 2026",
          "section": "Kantonzaken — eiser/verzoeker niet-natuurlijk persoon, vordering > €25.000",
          "url": "https://www.rechtspraak.nl/SiteCollectionDocuments/griffierecht-civiele-rechter-2026.pdf"
        }
      ],
      "conditions": {
        "zaakstroom": [
          "kanton"
        ],
        "rol": [
          "eiser",
          "verzoeker"
        ],
        "partijType": [
          "niet_natuurlijk_persoon"
        ],
        "vorderingWaarde": {
          "gt": 25000
        }
      },
      "outcome": {
        "griffierecht": {
          "amount": 727,
          "currency": "EUR"
        },
        "category": "kanton_nnp_boven_25000",
        "confidence": "deterministic",
        "manualReviewRequired": false
      },
      "examples": [
        {
          "input": {
            "vorderingWaarde": 50000
          },
          "expectedAmount": 727
        }
      ]
    },
    {
      "ruleId": "GR-KAN-2026-004",
      "name": "Kantonzaken — gedaagde/verweerder betaalt geen griffierecht",
      "priority": 250,
      "legalStatus": "wettelijk",
      "sourceRefs": [
        {
          "type": "wetsartikel",
          "title": "Wet griffierechten burgerlijke zaken (Wgbz)",
          "section": "Artikel 2, eerste lid — bij kantonzaken is alleen eiser/verzoeker griffierecht verschuldigd",
          "url": "https://wetten.overheid.nl/BWBR0035817/"
        }
      ],
      "conditions": {
        "zaakstroom": [
          "kanton"
        ],
        "rol": [
          "gedaagde",
          "verweerder"
        ]
      },
      "outcome": {
        "griffierecht": {
          "amount": null,
          "currency": "EUR"
        },
        "category": "kanton_gedaagde_niet_verschuldigd",
        "confidence": "deterministic",
        "manualReviewRequired": false
      },
      "examples": [
        {
          "input": {
            "verweerStatus": "ingediend"
          },
          "expectedAmount": 0
        }
      ]
    },
    {
      "ruleId": "GR-CIV-2026-001",
      "name": "Civiele zaak — onbepaalde waarde, natuurlijk persoon of onvermogend",
      "priority": 100,
      "legalStatus": "wettelijk",
      "sourceRefs": [
        {
          "type": "wetsartikel",
          "title": "Wet griffierechten burgerlijke zaken (Wgbz)",
          "section": "Artikel 2, tweede lid — griffierecht onbepaalde waarde",
          "url": "https://wetten.overheid.nl/BWBR0035817/"
        },
        {
          "type": "rechtspraak-tarieftabel",
          "title": "Griffierecht civiele rechter 2026",
          "section": "Zaken met een onbepaalde waarde — natuurlijk persoon / onvermogend",
          "url": "https://www.rechtspraak.nl/SiteCollectionDocuments/griffierecht-civiele-rechter-2026.pdf"
        }
      ],
      "conditions": {
        "zaakstroom": [
          "handel"
        ],
        "partijType": [
          "natuurlijk_persoon",
          "onvermogend"
        ],
        "vorderingWaarde": "onbepaald",
        "rol": [
          "eiser",
          "verzoeker"
        ]
      },
      "outcome": {
        "griffierecht": {
          "amount": 364,
          "currency": "EUR"
        },
        "category": "onbepaald_natuurlijk",
        "confidence": "deterministic",
        "manualReviewRequired": false
      },
      "examples": [
        {
          "input": {
            "vorderingWaarde": "onbepaald"
          },
          "expectedAmount": 364
        }
      ]
    },
    {
      "ruleId": "GR-CIV-2026-002",
      "name": "Civiele zaak — onbepaalde waarde, niet-natuurlijk persoon",
      "priority": 100,
      "legalStatus": "wettelijk",
      "sourceRefs": [
        {
          "type": "wetsartikel",
          "title": "Wet griffierechten burgerlijke zaken (Wgbz)",
          "section": "Artikel 2, tweede lid — griffierecht onbepaalde waarde, niet-natuurlijk persoon",
          "url": "https://wetten.overheid.nl/BWBR0035817/"
        },
        {
          "type": "rechtspraak-tarieftabel",
          "title": "Griffierecht civiele rechter 2026",
          "section": "Zaken met een onbepaalde waarde — niet-natuurlijk persoon",
          "url": "https://www.rechtspraak.nl/SiteCollectionDocuments/griffierecht-civiele-rechter-2026.pdf"
        }
      ],
      "conditions": {
        "zaakstroom": [
          "handel"
        ],
        "partijType": [
          "niet_natuurlijk_persoon"
        ],
        "vorderingWaarde": "onbepaald",
        "rol": [
          "eiser",
          "verzoeker"
        ]
      },
      "outcome": {
        "griffierecht": {
          "amount": 727,
          "currency": "EUR"
        },
        "category": "onbepaald_niet_natuurlijk",
        "confidence": "deterministic",
        "manualReviewRequired": false
      },
      "examples": [
        {
          "input": {
            "vorderingWaarde": "onbepaald"
          },
          "expectedAmount": 727
        }
      ]
    },
    {
      "ruleId": "GR-CIV-2026-003",
      "name": "Civiele zaak — vordering ≤ €100.000, natuurlijk persoon of onvermogend",
      "priority": 100,
      "legalStatus": "wettelijk",
      "sourceRefs": [
        {
          "type": "wetsartikel",
          "title": "Wet griffierechten burgerlijke zaken (Wgbz)",
          "section": "Artikel 2, tweede lid — griffierecht vordering ≤ €100.000",
          "url": "https://wetten.overheid.nl/BWBR0035817/"
        },
        {
          "type": "rechtspraak-tarieftabel",
          "title": "Griffierecht civiele rechter 2026",
          "section": "Zaken met een vordering of verzoek tot en met €100.000 — natuurlijk persoon / onvermogend",
          "url": "https://www.rechtspraak.nl/SiteCollectionDocuments/griffierecht-civiele-rechter-2026.pdf"
        }
      ],
      "conditions": {
        "zaakstroom": [
          "handel"
        ],
        "partijType": [
          "natuurlijk_persoon",
          "onvermogend"
        ],
        "vorderingWaarde": {
          "gte": 0,
          "lte": 100000
        },
        "rol": [
          "eiser",
          "verzoeker"
        ]
      },